{
  "$schema": "https://json-schema.org/draft/2020-12/schema",
  "$id": "urn:codemap:review:v1",
  "title": "codemap review report v1",
  "description": "The successful or gracefully degraded JSON report emitted by codemap review. Hard-failure envelopes are outside this schema.",
  "type": "object",
  "required": [
    "schema_version",
    "project",
    "mode",
    "depth",
    "is_repo",
    "indexed",
    "changed_files",
    "changed_symbols",
    "blast_radius",
    "covering_tests",
    "untested_symbols",
    "stale"
  ],
  "allOf": [
    {
      "if": {
        "properties": {
          "mode": {
            "const": "since"
          }
        }
      },
      "then": {
        "required": ["since"]
      }
    }
  ],
  "properties": {
    "schema_version": {
      "type": "integer",
      "const": 1
    },
    "project": {
      "type": "string"
    },
    "mode": {
      "type": "string",
      "enum": ["working", "staged", "since"]
    },
    "since": {
      "type": "string",
      "minLength": 1
    },
    "depth": {
      "type": "integer",
      "minimum": 1
    },
    "is_repo": {
      "type": "boolean"
    },
    "indexed": {
      "type": "boolean"
    },
    "changed_files": {
      "type": "array",
      "items": {
        "$ref": "#/$defs/review_file"
      }
    },
    "changed_symbols": {
      "type": "array",
      "maxItems": 200,
      "items": {
        "$ref": "#/$defs/symbol_ref"
      }
    },
    "analysis_complete": {
      "type": "boolean",
      "description": "True only when the index is fresh and every mapped changed symbol and supporting analysis stage succeeded."
    },
    "total_symbols": {
      "type": "integer",
      "minimum": 0,
      "description": "Total unique changed symbols mapped before the 200-symbol analysis cap."
    },
    "analyzed_symbols": {
      "type": "integer",
      "minimum": 0,
      "maximum": 200,
      "description": "Mapped changed symbols whose impact analysis completed successfully."
    },
    "truncated_symbols": {
      "type": "integer",
      "minimum": 0,
      "description": "Mapped changed symbols omitted by the 200-symbol analysis cap."
    },
    "partial_errors": {
      "type": "array",
      "minItems": 1,
      "maxItems": 20,
      "items": {
        "$ref": "#/$defs/partial_error"
      }
    },
    "partial_errors_truncated": {
      "type": "integer",
      "minimum": 1,
      "description": "Additional partial errors omitted after the bounded 20-item list."
    },
    "blast_radius": {
      "type": "array",
      "items": {
        "$ref": "#/$defs/impact_node"
      }
    },
    "covering_tests": {
      "type": "array",
      "items": {
        "$ref": "#/$defs/impact_node"
      }
    },
    "untested_symbols": {
      "type": "array",
      "maxItems": 200,
      "items": {
        "$ref": "#/$defs/symbol_ref"
      }
    },
    "hotspots": {
      "type": "array",
      "maxItems": 200,
      "minItems": 1,
      "items": {
        "$ref": "#/$defs/symbol_ref"
      }
    },
    "stale": {
      "type": "boolean"
    },
    "staleness": {
      "$ref": "#/$defs/staleness"
    },
    "resolution": {
      "type": "string",
      "minLength": 1
    },
    "call_graph": {
      "type": "string",
      "enum": ["resolved", "name", "unresolved", "none"]
    },
    "risk": {
      "$ref": "#/$defs/risk"
    },
    "coverage": {
      "$ref": "#/$defs/coverage"
    },
    "deletion_analysis": {
      "$ref": "#/$defs/deletion_analysis"
    },
    "note": {
      "type": "string",
      "minLength": 1
    },
    "test_commands": {
      "type": "array",
      "minItems": 1,
      "items": {
        "type": "string",
        "minLength": 1
      }
    },
    "next": {
      "type": "array",
      "minItems": 1,
      "maxItems": 2,
      "items": {
        "$ref": "#/$defs/next_action"
      }
    },
    "gate": {
      "type": "object",
      "description": "Computed CI-gate signal so a harness reproduces the CLI --fail-on-risk/--fail-on-untested exit-6 logic from the report alone.",
      "required": ["risk_level", "analysis_complete", "would_fail_on"],
      "properties": {
        "risk_level": {
          "type": "string"
        },
        "analysis_complete": {
          "type": "boolean"
        },
        "would_fail_on": {
          "type": "object",
          "required": ["incomplete_analysis", "untested", "risk_at_or_above"],
          "properties": {
            "incomplete_analysis": {
              "type": "boolean"
            },
            "untested": {
              "type": "boolean"
            },
            "uncovered": {
              "type": "boolean",
              "description": "--fail-on-uncovered would trip: coverage.verdict is uncovered or partial with known-uncovered symbols. Never true for unknown coverage."
            },
            "risk_at_or_above": {
              "type": "object",
              "required": ["low", "medium", "high"],
              "properties": {
                "low": {"type": "boolean"},
                "medium": {"type": "boolean"},
                "high": {"type": "boolean"}
              },
              "additionalProperties": true
            }
          },
          "additionalProperties": true
        }
      },
      "additionalProperties": true
    }
  },
  "additionalProperties": true,
  "$defs": {
    "review_file": {
      "type": "object",
      "required": ["path", "status", "symbols"],
      "properties": {
        "path": {
          "type": "string",
          "minLength": 1
        },
        "status": {
          "type": "string",
          "enum": ["A", "M", "D", "?"]
        },
        "symbols": {
          "type": "integer",
          "minimum": 0
        }
      },
      "additionalProperties": true
    },
    "symbol_ref": {
      "type": "object",
      "required": ["symbol", "kind", "file", "start_line", "end_line"],
      "properties": {
        "symbol": {
          "type": "string",
          "minLength": 1
        },
        "fqn": {
          "type": "string",
          "minLength": 1
        },
        "kind": {
          "type": "string",
          "enum": ["file", "function", "method", "type", "class", "module", "variable", "test"]
        },
        "file": {
          "type": "string",
          "minLength": 1
        },
        "start_line": {
          "type": "integer",
          "minimum": 1
        },
        "end_line": {
          "type": "integer",
          "minimum": 1
        },
        "signature": {
          "type": "string",
          "minLength": 1
        },
        "doc": {
          "type": "string",
          "minLength": 1
        }
      },
      "additionalProperties": true
    },
    "partial_error": {
      "type": "object",
      "required": ["stage", "code", "message"],
      "properties": {
        "stage": {
          "type": "string",
          "enum": ["staleness", "mapping", "impact"]
        },
        "code": {
          "type": "string",
          "enum": ["staleness_failed", "symbol_mapping_failed", "deletion_only_hunk", "deletion_hunk_unmapped", "removed_definition_unavailable", "rename_unmapped", "impact_failed", "impact_unavailable", "symbol_not_found"]
        },
        "message": {
          "type": "string",
          "minLength": 1
        },
        "file": {
          "type": "string",
          "minLength": 1
        },
        "symbol": {
          "$ref": "#/$defs/symbol_ref"
        }
      },
      "additionalProperties": true
    },
    "impact_node": {
      "type": "object",
      "required": ["symbol", "kind", "file", "start_line", "depth"],
      "properties": {
        "symbol": {
          "type": "string",
          "minLength": 1
        },
        "fqn": {
          "type": "string",
          "minLength": 1
        },
        "kind": {
          "type": "string",
          "enum": ["file", "function", "method", "type", "class", "module", "variable", "test"]
        },
        "file": {
          "type": "string",
          "minLength": 1
        },
        "start_line": {
          "type": "integer",
          "minimum": 1
        },
        "depth": {
          "type": "integer",
          "minimum": 0
        },
        "signature": {
          "type": "string",
          "minLength": 1
        },
        "doc": {
          "type": "string",
          "minLength": 1
        },
        "heuristic": {
          "type": "boolean",
          "const": true
        },
        "confidence": {
          "type": "string",
          "enum": ["confirmed", "candidate"],
          "description": "confirmed: every edge on a shortest path is precise or same-file; candidate: name-based fan-out or a heuristic test link."
        }
      },
      "additionalProperties": true
    },
    "staleness": {
      "type": "object",
      "required": ["changed", "new", "deleted"],
      "properties": {
        "changed": {
          "type": "integer",
          "minimum": 0
        },
        "new": {
          "type": "integer",
          "minimum": 0
        },
        "deleted": {
          "type": "integer",
          "minimum": 0
        }
      },
      "additionalProperties": true
    },
    "deletion_analysis": {
      "type": "object",
      "required": ["files", "analyzed", "missing", "source", "complete"],
      "properties": {
        "files": {
          "type": "integer",
          "minimum": 1
        },
        "analyzed": {
          "type": "integer",
          "minimum": 0
        },
        "missing": {
          "type": "integer",
          "minimum": 0
        },
        "source": {
          "type": "string",
          "const": "last_index"
        },
        "complete": {
          "type": "boolean"
        }
      },
      "additionalProperties": true
    },
    "coverage": {
      "type": "object",
      "description": "Test-coverage verdict, separate from the structural risk band. unknown means coverage cannot be determined (unresolved call graph and no name-based test link) and is never evidence of missing tests.",
      "required": ["verdict", "covered_symbols", "uncovered_symbols", "unknown_symbols"],
      "properties": {
        "verdict": {
          "type": "string",
          "enum": ["covered", "partial", "uncovered", "unknown"]
        },
        "covered_symbols": {
          "type": "integer",
          "minimum": 0
        },
        "uncovered_symbols": {
          "type": "integer",
          "minimum": 0
        },
        "unknown_symbols": {
          "type": "integer",
          "minimum": 0
        }
      },
      "additionalProperties": true
    },
    "risk": {
      "type": "object",
      "required": ["level", "score", "factors"],
      "properties": {
        "level": {
          "type": "string",
          "enum": ["unknown", "low", "medium", "high"]
        },
        "score": {
          "type": "number",
          "minimum": 0,
          "maximum": 1
        },
        "factors": {
          "type": "array",
          "maxItems": 5,
          "items": {
            "$ref": "#/$defs/risk_factor"
          }
        }
      },
      "additionalProperties": true
    },
    "risk_factor": {
      "type": "object",
      "required": ["factor", "severity", "detail"],
      "properties": {
        "factor": {
          "type": "string",
          "enum": ["untested_changes", "hotspot_fanin", "cross_package", "ambiguity", "unresolved"]
        },
        "severity": {
          "type": "number",
          "minimum": 0,
          "maximum": 1
        },
        "detail": {
          "type": "string",
          "minLength": 1
        }
      },
      "additionalProperties": true
    },
    "next_action": {
      "type": "object",
      "required": ["tool", "why"],
      "properties": {
        "tool": {
          "type": "string",
          "enum": ["codemap_index", "terminal", "codemap_risk"]
        },
        "args": {
          "type": "object",
          "additionalProperties": true
        },
        "why": {
          "type": "string",
          "minLength": 1
        }
      },
      "additionalProperties": true
    }
  }
}
