{
  "schema_version": 1,
  "project": "contract-project",
  "mode": "working",
  "depth": 3,
  "is_repo": true,
  "indexed": true,
  "changed_files": [
    {
      "path": "a.go",
      "status": "M",
      "symbols": 1
    }
  ],
  "changed_symbols": [
    {
      "symbol": "Run",
      "fqn": "app.Run",
      "kind": "function",
      "file": "a.go",
      "start_line": 5,
      "end_line": 7,
      "signature": "func Run()"
    }
  ],
  "analysis_complete": false,
  "total_symbols": 1,
  "analyzed_symbols": 1,
  "truncated_symbols": 0,
  "blast_radius": [
    {
      "symbol": "TestRun",
      "fqn": "app.TestRun",
      "kind": "test",
      "file": "a_test.go",
      "start_line": 5,
      "depth": 1,
      "signature": "func TestRun(t *testing.T)",
      "confidence": "candidate"
    },
    {
      "symbol": "Other",
      "fqn": "app.Other",
      "kind": "function",
      "file": "b.go",
      "start_line": 3,
      "depth": 1,
      "signature": "func Other()",
      "confidence": "candidate"
    }
  ],
  "covering_tests": [
    {
      "symbol": "TestRun",
      "fqn": "app.TestRun",
      "kind": "test",
      "file": "a_test.go",
      "start_line": 5,
      "depth": 1,
      "signature": "func TestRun(t *testing.T)",
      "confidence": "candidate"
    }
  ],
  "untested_symbols": [],
  "stale": true,
  "staleness": {
    "changed": 1,
    "new": 0,
    "deleted": 0
  },
  "call_graph": "name",
  "risk": {
    "level": "unknown",
    "score": 0,
    "factors": []
  },
  "coverage": {
    "verdict": "covered",
    "covered_symbols": 1,
    "uncovered_symbols": 0,
    "unknown_symbols": 0
  },
  "test_commands": [
    "go test ./ -run '^(TestRun)$'"
  ],
  "next": [
    {
      "tool": "codemap_index",
      "args": {
        "path": "contract-project"
      },
      "why": "the index is stale; refresh it before trusting diff-scoped impact"
    },
    {
      "tool": "terminal",
      "args": {
        "command": "go test ./ -run '^(TestRun)$'"
      },
      "why": "run the selected regression tests that cover this changeset"
    }
  ],
  "gate": {
    "risk_level": "unknown",
    "analysis_complete": false,
    "would_fail_on": {
      "incomplete_analysis": true,
      "untested": false,
      "uncovered": false,
      "risk_at_or_above": {
        "low": false,
        "medium": false,
        "high": false
      }
    }
  }
}
