{
  "schema_version": 1,
  "project": "hand-authored-fixture",
  "mode": "working",
  "depth": 3,
  "is_repo": true,
  "indexed": true,
  "changed_files": [
    { "path": "README.md", "status": "M", "symbols": 0 }
  ],
  "changed_symbols": [],
  "blast_radius": [],
  "covering_tests": [],
  "untested_symbols": [],
  "stale": false,
  "note": "changed lines don't map to indexed symbols (comments, imports, or unindexed/untracked files) — nothing to analyze",
  "test_commands": []
}
