{
  "schema_version": 1,
  "project": "hand-authored-fixture",
  "mode": "staged",
  "depth": 3,
  "is_repo": true,
  "indexed": true,
  "changed_files": [
    { "path": "src/widget.ts", "status": "M", "symbols": 1 }
  ],
  "changed_symbols": [
    {
      "symbol": "renderWidget",
      "fqn": "widget.renderWidget",
      "kind": "function",
      "file": "src/widget.ts",
      "start_line": 4,
      "end_line": 9,
      "signature": "function renderWidget(props: Props): JSX.Element"
    }
  ],
  "analysis_complete": true,
  "total_symbols": 1,
  "analyzed_symbols": 1,
  "truncated_symbols": 0,
  "blast_radius": [],
  "covering_tests": [],
  "untested_symbols": [],
  "stale": false,
  "resolution": "call graph not available for typescript without precise indexing — direct callers, blast radius, and covering tests are unresolved (not absent); run 'codemap index --precise' to resolve them",
  "call_graph": "unresolved",
  "risk": {
    "level": "unknown",
    "score": 0,
    "factors": [
      { "factor": "unresolved", "severity": 0.4, "detail": "call graph could not be resolved for this changed symbol" }
    ]
  }
}
