{
  "schema_version": 1,
  "project": "hand-authored-fixture",
  "mode": "working",
  "depth": 3,
  "is_repo": false,
  "indexed": false,
  "changed_files": [],
  "changed_symbols": [],
  "analysis_complete": false,
  "total_symbols": 0,
  "analyzed_symbols": 0,
  "truncated_symbols": 0,
  "blast_radius": [],
  "covering_tests": [],
  "untested_symbols": [],
  "stale": false,
  "note": "not a git repository — codemap review needs git to compute the diff"
}
